{
  "schema_version": 4,
  "slug": "saymyname",
  "name": "SayMyName",
  "operator_name": "Benjamin",
  "north_star": "Prouver que SayMyName aide une personne à mieux retrouver les gens qu’elle a choisi de mémoriser, puis trouver un canal et un acheteur répétables.",
  "strategy": "docs/products/saymyname/PRODUCT_STRATEGY.md",
  "decisions": "docs/products/saymyname/DECISIONS.md",
  "release_contract": "config/releases/saymyname-v1.json",
  "project_inventory": "docs/products/saymyname/PROJECT_INVENTORY.md",
  "design_governance": "docs/products/saymyname/DESIGN_GOVERNANCE.md",
  "inventory_watch": [
    "Frontend/.git/logs/HEAD",
    "Backend/.git/logs/HEAD"
  ],
  "po_workspace": "/mnt/c/Dev/Projects/SayMyName",
  "po_add_dirs": [
    "/home/benja/agent-factory"
  ],
  "status_command": [
    "bin/saymyname-product-status"
  ],
  "queue_command": [
    "bin/saymyname-product-queue",
    "list",
    "--json"
  ],
  "queue_mutation_command": [
    "bin/saymyname-product-queue"
  ],
  "preview_command": [
    "bin/saymyname-preview"
  ],
  "preview_browser_url": "http://127.0.0.1:5173/",
  "preview_version_policy": "dev synchronisé avec origin/dev, dépôts propres, SHA affichés",
  "preview_components": [
    {"id": "frontend", "label": "Frontend", "command": "npm run dev"},
    {"id": "backend", "label": "Backend", "command": "./mvnw spring-boot:run"}
  ],
  "decision_blockers": [
    {"work_ref": "af-hxji", "decision_ref": "Visibilité et conservation des groupes"}
  ],
  "capabilities": [
    {"id": "challenge", "title": "Challenges publics", "area": "Acquisition", "roadmap": 1, "source_refs": ["vision", "journeys", "rights", "roadmap"], "decision_refs": ["Public cultural challenges are product", "Presidents first for the localized public demo"]},
    {"id": "personal", "title": "Espace personnel", "area": "Produit cœur", "roadmap": 1, "source_refs": ["vision", "users", "journeys", "rights"], "decision_refs": ["Personal learning home in V1", "Three sources and learner choice"]},
    {"id": "learning", "title": "Moteur d’apprentissage", "area": "Produit cœur", "roadmap": 1, "source_refs": ["vision", "acceptance"], "decision_refs": ["Social-memory companion product vision"]},
    {"id": "groups", "title": "Promotions et événements", "area": "Collaboration", "roadmap": 2, "source_refs": ["users", "journeys", "rights", "roadmap"], "decision_refs": ["Visibilité et conservation des groupes"]},
    {"id": "organizations", "title": "Organisations administrées", "area": "B2B", "roadmap": 3, "source_refs": ["users", "journeys", "rights"], "decision_refs": ["Three organization archetypes"]},
    {"id": "imports", "title": "Imports de personnes", "area": "Activation", "roadmap": 3, "source_refs": ["journeys", "rights", "future"], "decision_refs": ["Import is core, authority remains explicit", "Google Contacts selected as the first external connector"]},
    {"id": "editorial", "title": "Publication éditoriale", "area": "Contenu", "roadmap": 5, "source_refs": ["journeys", "rights", "roadmap"], "decision_refs": ["Public cultural challenges are product"]},
    {"id": "retrieval", "title": "Recherche par indices", "area": "Produit cœur", "roadmap": 6, "source_refs": ["journeys", "rights", "future"], "decision_refs": ["Intelligent retrieval without invented identity"]},
    {"id": "connectors", "title": "Connecteurs externes", "area": "Activation", "roadmap": 7, "source_refs": ["journeys", "rights", "future"], "decision_refs": ["Google Contacts selected as the first external connector"]},
    {"id": "federation", "title": "Organisation fédérée", "area": "Entreprise", "roadmap": 8, "source_refs": ["rights", "future"], "decision_refs": ["Three organization archetypes"]},
    {"id": "business", "title": "Prix et lancement", "area": "Entreprise", "roadmap": 9, "source_refs": ["roadmap", "acceptance", "future"], "decision_refs": ["Frozen V1 product boundary"]}
  ],
  "relations": [
    ["challenge", "personal"],
    ["groups", "personal"],
    ["organizations", "imports"],
    ["imports", "personal"],
    ["personal", "learning"],
    ["editorial", "challenge"],
    ["personal", "retrieval"],
    ["connectors", "imports"],
    ["federation", "organizations"],
    ["learning", "business"]
  ],
  "journeys": [
    {"id": "discover-learn", "title": "Découvrir puis apprendre", "detail": "Essayer un challenge public, choisir quoi retenir et revenir dans son espace personnel.", "roadmap": 1, "capability_refs": ["challenge", "personal", "learning"], "source_refs": ["vision", "journeys", "acceptance"], "decision_refs": ["Public cultural challenges are product", "Personal learning home in V1"]},
    {"id": "group-pilot", "title": "Rejoindre une promotion", "detail": "Entrer par lien ou QR, créer ou vérifier son profil puis choisir des personnes à apprendre en privé.", "roadmap": 2, "capability_refs": ["groups", "personal", "learning"], "source_refs": ["users", "journeys", "rights", "acceptance"], "decision_refs": ["Visibilité et conservation des groupes"]},
    {"id": "csv-activation", "title": "Importer jusqu’au premier quiz", "detail": "Mapper, prévisualiser et confirmer un CSV sans confondre profil, compte, invitation ou publication.", "roadmap": 3, "capability_refs": ["organizations", "imports", "personal", "learning"], "source_refs": ["journeys", "rights", "acceptance"], "decision_refs": ["Import is core, authority remains explicit"]},
    {"id": "publish-challenge", "title": "Publier un challenge sûr", "detail": "Préparer, vérifier les droits, publier et pouvoir retirer une collection versionnée.", "roadmap": 5, "capability_refs": ["editorial", "challenge"], "source_refs": ["journeys", "rights"], "decision_refs": ["Public cultural challenges are product"]},
    {"id": "find-person", "title": "Retrouver avec des indices", "detail": "Chercher seulement parmi les personnes autorisées, expliquer les correspondances et s’abstenir si nécessaire.", "roadmap": 6, "capability_refs": ["personal", "retrieval"], "source_refs": ["journeys", "rights", "future"], "decision_refs": ["Intelligent retrieval without invented identity"]}
  ],
  "business_objectives": [
    {"id": "value", "title": "Prouver la valeur utilisateur", "detail": "Un visiteur comprend, essaie puis souhaite continuer à mémoriser.", "roadmap": 1},
    {"id": "pilot", "title": "Réussir un premier pilote", "detail": "Une cohorte réelle s’active, revient et rapporte une utilité en situation.", "roadmap": 2},
    {"id": "buyer", "title": "Identifier le premier acheteur", "detail": "Une personne précise reconnaît le problème et accepte de tester une offre.", "roadmap": 9},
    {"id": "launch", "title": "Rendre le lancement répétable", "detail": "Acquisition, activation, support et mesure fonctionnent sans bricolage fondateur.", "roadmap": 9}
  ],
  "product_reference": [
    {"id": "vision", "title": "Vision et promesse", "summary": "Pourquoi SayMyName existe, pour qui et quelle amélioration humaine il doit produire.", "status": "validated", "status_label": "Validé", "sources": [{"path": "docs/products/saymyname/PRODUCT_STRATEGY.md", "sections": ["Product thesis", "Four memory jobs"]}]},
    {"id": "users", "title": "Utilisateurs et situations", "summary": "Apprenant, membre, organisateur et administrateur dans leurs contextes d’usage.", "status": "review", "status_label": "À consolider", "sources": [{"path": "docs/products/saymyname/PRODUCT_CONTEXT.md", "sections": ["Core users"]}]},
    {"id": "journeys", "title": "Parcours de bout en bout", "summary": "Découvrir, mémoriser, rejoindre, importer, publier et retrouver.", "status": "review", "status_label": "À valider", "sources": [{"path": "docs/products/saymyname/PRODUCT_STRATEGY.md", "sections": ["Personal home", "Initial school pilot", "Public challenges", "Imports", "Intelligent retrieval"]}]},
    {"id": "rights", "title": "Concepts et droits", "summary": "Personnes, comptes, sélections, groupes, organisations, sources et accès.", "status": "validated", "status_label": "Documenté", "sources": [{"path": "docs/products/saymyname/PRODUCT_STRATEGY.md", "sections": ["People and access model", "Organization archetypes"]}, {"path": "docs/products/saymyname/PRODUCT_CONTEXT.md", "sections": ["Product principles"]}]},
    {"id": "views", "title": "Vues et états UI", "summary": "Inventaire des écrans existants, en construction, planifiés et dépendants d’une preuve.", "status": "live", "status_label": "Suivi vivant", "sources": [{"path": "docs/products/saymyname/PROJECT_INVENTORY.md", "sections": ["View catalogue", "Functional capabilities already present"]}, {"path": "docs/products/saymyname/DESIGN_GOVERNANCE.md", "sections": ["Definition of design-ready"]}]},
    {"id": "acceptance", "title": "Critères et preuves", "summary": "Ce qu’un humain doit pouvoir observer pour valider valeur, sécurité et livraison.", "status": "review", "status_label": "À enrichir", "sources": [{"path": "docs/products/saymyname/PRODUCT_STRATEGY.md", "sections": ["Measurement"]}, {"path": "docs/products/saymyname/DESIGN_GOVERNANCE.md", "sections": ["Approval tiers", "Definition of design-ready"]}]},
    {"id": "roadmap", "title": "Roadmap et décisions", "summary": "Ordre durable des résultats, hypothèses et décisions explicites encore attendues.", "status": "live", "status_label": "Suivi vivant", "sources": [{"path": "docs/products/saymyname/PRODUCT_STRATEGY.md", "sections": ["Product roadmap"]}, {"path": "docs/products/saymyname/DECISIONS.md", "sections": ["Open"]}]},
    {"id": "future", "title": "Frontières et futur", "summary": "Extensions après preuve et comportements explicitement différés ou interdits.", "status": "validated", "status_label": "Borné", "sources": [{"path": "docs/products/saymyname/PRODUCT_STRATEGY.md", "sections": ["Offers and payment hypothesis", "Explicitly deferred or prohibited by default"]}]}
  ],
  "view_inventory": [